{
  "header": {
    "insured_name": "Lone Star Property Holdings, LP",
    "carrier_name": "Apex Managing General Agency",
    "policy_numbers": {
      "wc": null,
      "gl": null,
      "auto": null,
      "property": "CP-LSPH-2025-7801",
      "umbrella": null,
      "mtc": null
    },
    "report_date": "2026-03-15",
    "policy_period_start": "2025-07-01",
    "policy_period_end": "2026-07-01"
  },
  "claims": [
    {
      "claim_number": "CNA-2025-033500",
      "date_of_loss": "2025-06-13",
      "claimant": "Lone Star Property Holdings, LP",
      "status": "Open",
      "coverage": "property",
      "paid": 137976.38,
      "reserved": 44151.06,
      "incurred": 197782.57,
      "description": "Cause: Fire; Location: 8117 Preston Road, Dallas, TX; Adj. Expense: 15655.13; INT_STATUS: CLO-F. Note: Incurred (197782.57) = Paid (137976.38) + Reserved (44151.06) + Adj. Expense (15655.13); INT_STATUS conflicts with Claim State \u2014 Claim State governs."
    },
    {
      "claim_number": "AIG-2023-033710",
      "date_of_loss": "2023-06-09",
      "claimant": "Lone Star Property Holdings, LP",
      "status": "Closed",
      "coverage": "property",
      "paid": 95695.8,
      "reserved": 0,
      "incurred": 105450.03,
      "description": "Cause: Lightning; Location: 800 8th Avenue, Fort Worth, TX; Adj. Expense: 9754.23; INT_STATUS: DEN-C. Internal workflow sub-row present on this claim (EXM-444 / Re-exam / LIT-A) \u2014 treated as activity metadata, not a separate claim. Note: Incurred (105450.03) = Paid (95695.80) + Reserved (0) + Adj. Expense (9754.23); INT_STATUS conflicts with Claim State \u2014 Claim State governs."
    },
    {
      "claim_number": "BHG-2021-033637",
      "date_of_loss": "2021-06-30",
      "claimant": "Lone Star Property Holdings, LP",
      "status": "Closed",
      "coverage": "property",
      "paid": 0,
      "reserved": 0,
      "incurred": 0,
      "description": "Cause: Vandalism; Location: 5060 Westheimer Road, Houston, TX; Claim State: Denied (mapped to Closed); INT_STATUS: OPN-A. INT_STATUS conflicts with Claim State \u2014 Claim State governs."
    }
  ],
  "subtotals_by_coverage": {
    "wc": {
      "paid": 0,
      "reserved": 0,
      "incurred": 0,
      "claim_count": 0
    },
    "gl": {
      "paid": 0,
      "reserved": 0,
      "incurred": 0,
      "claim_count": 0
    },
    "auto": {
      "paid": 0,
      "reserved": 0,
      "incurred": 0,
      "claim_count": 0
    },
    "property": {
      "paid": 233672.18,
      "reserved": 44151.06,
      "incurred": 303232.6,
      "claim_count": 3
    },
    "umbrella": {
      "paid": 0,
      "reserved": 0,
      "incurred": 0,
      "claim_count": 0
    },
    "mtc": {
      "paid": 0,
      "reserved": 0,
      "incurred": 0,
      "claim_count": 0
    }
  },
  "grand_totals": {
    "paid": 233672.18,
    "reserved": 44151.06,
    "incurred": 303232.6,
    "claim_count": 3
  }
}