{
  "header": {
    "insured_name": "Buckeye Industrial Properties, LLC",
    "carrier_name": "Maine Employers Mutual",
    "policy_numbers": {
      "wc": null,
      "gl": null,
      "auto": null,
      "property": "CP-BIP-2025-4420",
      "umbrella": null,
      "mtc": null
    },
    "report_date": "2026-03-15",
    "policy_period_start": "2025-09-01",
    "policy_period_end": "2026-09-01"
  },
  "claims": [
    {
      "claim_number": "MEM-2025-013016",
      "date_of_loss": "2025-10-17",
      "claimant": "Buckeye Industrial Properties, LLC",
      "status": "Open",
      "coverage": "property",
      "paid": 190238.21,
      "reserved": 35679.44,
      "incurred": 225917.65,
      "description": "Water Damage at 2100 Kuntz Road, Dayton, OH"
    },
    {
      "claim_number": "HTF-2021-013149",
      "date_of_loss": "2021-10-09",
      "claimant": "Buckeye Industrial Properties, LLC",
      "status": "Closed",
      "coverage": "property",
      "paid": 0.0,
      "reserved": 0.0,
      "incurred": 0.0,
      "description": "Equipment Breakdown at 11600 Mosteller Road, Cincinnati, OH"
    }
  ],
  "subtotals_by_coverage": {
    "wc": {
      "paid": 0.0,
      "reserved": 0.0,
      "incurred": 0.0,
      "claim_count": 0
    },
    "gl": {
      "paid": 0.0,
      "reserved": 0.0,
      "incurred": 0.0,
      "claim_count": 0
    },
    "auto": {
      "paid": 0.0,
      "reserved": 0.0,
      "incurred": 0.0,
      "claim_count": 0
    },
    "property": {
      "paid": 190238.21,
      "reserved": 35679.44,
      "incurred": 225917.65,
      "claim_count": 2
    },
    "umbrella": {
      "paid": 0.0,
      "reserved": 0.0,
      "incurred": 0.0,
      "claim_count": 0
    },
    "mtc": {
      "paid": 0.0,
      "reserved": 0.0,
      "incurred": 0.0,
      "claim_count": 0
    }
  },
  "grand_totals": {
    "paid": 190238.21,
    "reserved": 35679.44,
    "incurred": 225917.65,
    "claim_count": 2
  }
}